{
  "$schema": "https://json-schema.org/draft/2020-12/schema",
  "$id": "urn:lifecycle:schema:discipline-pack:v1",
  "title": "Lifecycle Discipline Pack v1",
  "description": "A fresh-only distribution manifest for independently adoptable Discipline records and curated Sets.",
  "type": "object",
  "additionalProperties": false,
  "required": ["schema", "id", "title", "version", "publisher", "contract", "records", "sets", "digest"],
  "properties": {
    "schema": { "const": "lifecycle.discipline-pack.v1" },
    "id": { "$ref": "urn:lifecycle:schema:common:v2#/$defs/opaqueId" },
    "title": { "$ref": "urn:lifecycle:schema:common:v2#/$defs/singleLine" },
    "version": { "$ref": "urn:lifecycle:schema:common:v2#/$defs/opaqueId" },
    "publisher": { "$ref": "urn:lifecycle:schema:common:v2#/$defs/ownerId" },
    "contract": {
      "type": "object",
      "additionalProperties": false,
      "required": ["specificationRevision", "knowledgeRecordSchema"],
      "properties": {
        "specificationRevision": { "$ref": "urn:lifecycle:schema:common:v2#/$defs/opaqueId", "description": "Exact Pack authoring provenance; adoption validates record bytes against the current selected Knowledge schema and target contract." },
        "knowledgeRecordSchema": { "const": "urn:lifecycle:schema:knowledge-record:v2" }
      }
    },
    "records": {
      "type": "array",
      "minItems": 1,
      "maxItems": 65536,
      "items": { "$ref": "#/$defs/record" }
    },
    "sets": {
      "description": "Publisher presentation sequence retained in the manifest digest; Set identities are unique, without a lexical outer-order requirement.",
      "type": "array",
      "maxItems": 4096,
      "items": { "$ref": "#/$defs/set" }
    },
    "digest": { "$ref": "urn:lifecycle:schema:common:v2#/$defs/sha256" }
  },
  "$defs": {
    "record": {
      "type": "object",
      "additionalProperties": false,
      "required": ["id", "path", "revision", "sourceDigest", "semanticDigest"],
      "properties": {
        "id": {
          "allOf": [
            { "$ref": "urn:lifecycle:schema:common:v2#/$defs/knowledgeId" },
            { "pattern": "^discipline\\." }
          ]
        },
        "path": { "allOf": [{ "$ref": "urn:lifecycle:schema:common:v2#/$defs/normalizedPath" }, { "pattern": "^records/.+\\.md$" }] },
        "revision": { "$ref": "urn:lifecycle:schema:common:v2#/$defs/positiveSafeInteger" },
        "sourceDigest": { "$ref": "urn:lifecycle:schema:common:v2#/$defs/sha256" },
        "semanticDigest": { "$ref": "urn:lifecycle:schema:common:v2#/$defs/sha256" }
      }
    },
    "set": {
      "type": "object",
      "additionalProperties": false,
      "required": ["id", "title", "description", "recordIds"],
      "properties": {
        "id": { "$ref": "urn:lifecycle:schema:common:v2#/$defs/opaqueId" },
        "title": { "$ref": "urn:lifecycle:schema:common:v2#/$defs/singleLine" },
        "description": { "$ref": "urn:lifecycle:schema:common:v2#/$defs/plainText" },
        "recordIds": {
          "type": "array",
          "minItems": 1,
          "maxItems": 4096,
          "uniqueItems": true,
          "items": {
            "allOf": [
              { "$ref": "urn:lifecycle:schema:common:v2#/$defs/knowledgeId" },
              { "pattern": "^discipline\\." }
            ]
          }
        }
      }
    }
  }
}
